product_name,product_price,Rate,Review,Summary,Sentiment
"cello Pack of 18 Opalware Cello Dazzle Lush Fiesta Opalware Dinner Set, 18 Pieces Dinner SetГѓЖ’Г‚вЂљГѓвЂљГ‚В ГѓЖ’Г‚вЂљГѓвЂљГ‚В (White, Microwave Safe)",1299,3,nice,it was oky,neutral
"cello Pack of 18 Opalware Cello Dazzle Lush Fiesta Opalware Dinner Set, 18 Pieces Dinner SetГѓЖ’Г‚вЂљГѓвЂљГ‚В ГѓЖ’Г‚вЂљГѓвЂљГ‚В (White, Microwave Safe)",1299,3,decent product,bowl size is too small,neutral
"cello Pack of 18 Opalware Cello Dazzle Lush Fiesta Opalware Dinner Set, 18 Pieces Dinner SetГѓЖ’Г‚вЂљГѓвЂљГ‚В ГѓЖ’Г‚вЂљГѓвЂљГ‚В (White, Microwave Safe)",1299,1,hated it!,ok,neutral
"cello Pack of 18 Opalware Cello Dazzle Lush Fiesta Opalware Dinner Set, 18 Pieces Dinner SetГѓЖ’Г‚вЂљГѓвЂљГ‚В ГѓЖ’Г‚вЂљГѓвЂљГ‚В (White, Microwave Safe)",1299,4,good choice,pure kaaaaj h,neutral
"cello Pack of 18 Opalware Cello Dazzle Lush Fiesta Opalware Dinner Set, 18 Pieces Dinner SetГѓЖ’Г‚вЂљГѓвЂљГ‚В ГѓЖ’Г‚вЂљГѓвЂљГ‚В (White, Microwave Safe)",1299,4,pretty good,honey finish,neutral
"cello Pack of 18 Opalware Cello Dazzle Lush Fiesta Opalware Dinner Set, 18 Pieces Dinner SetГѓЖ’Г‚вЂљГѓвЂљГ‚В ГѓЖ’Г‚вЂљГѓвЂљГ‚В (White, Microwave Safe)",1299,3,nice,quality is ok,neutral
"cello Pack of 18 Opalware Cello Dazzle Lush Fiesta Opalware Dinner Set, 18 Pieces Dinner SetГѓЖ’Г‚вЂљГѓвЂљГ‚В ГѓЖ’Г‚вЂљГѓвЂљГ‚В (White, Microwave Safe)",1299,2,could be way better,ok,neutral
"cello Pack of 18 Opalware Cello Dazzle Lush Fiesta Opalware Dinner Set, 18 Pieces Dinner SetГѓЖ’Г‚вЂљГѓвЂљГ‚В ГѓЖ’Г‚вЂљГѓвЂљГ‚В (White, Microwave Safe)",1299,4,value-for-money,very good but mixing bowl not included is one disappointmentand soup bowl is small in size,neutral
"MAHARAJA WHITELINE 65 L Desert Air Cooler??????(White, Grey, Rambo Grey / AC-303)",7999,1,not recommended at all,send damage product dont buy,negative
"MAHARAJA WHITELINE 65 L Desert Air Cooler??????(White, Grey, Rambo Grey / AC-303)",7999,3,utterly disappointed,item is vry bad i hate flipcart item this watch is,negative
"MAHARAJA WHITELINE 65 L Desert Air Cooler??????(White, Grey, Rambo Grey / AC-303)",7999,5,brilliant,good productbuying worst,negative
"MAHARAJA WHITELINE 65 L Desert Air Cooler??????(White, Grey, Rambo Grey / AC-303)",7999,2,bad quality,speed not good very slow,negative
"MAHARAJA WHITELINE 65 L Desert Air Cooler??????(White, Grey, Rambo Grey / AC-303)",7999,1,horrible,waste of money dont buy,negative
"MAHARAJA WHITELINE 65 L Desert Air Cooler??????(White, Grey, Rambo Grey / AC-303)",7999,1,not recommended at all,unhappy,negative
"MAHARAJA WHITELINE 65 L Desert Air Cooler??????(White, Grey, Rambo Grey / AC-303)",7999,3,fair,cooler body is very weak,negative
"MAHARAJA WHITELINE 65 L Desert Air Cooler??????(White, Grey, Rambo Grey / AC-303)",7999,1,very poor,bad,negative
"MAHARAJA WHITELINE 65 L Desert Air Cooler??????(White, Grey, Rambo Grey / AC-303)",7999,1,utterly disappointed,defective product,negative
"MAHARAJA WHITELINE 65 L Desert Air Cooler??????(White, Grey, Rambo Grey / AC-303)",7999,5,terrific,nice products but one problem brod size,negative
"MAHARAJA WHITELINE 65 L Desert Air Cooler??????(White, Grey, Rambo Grey / AC-303)",7999,2,bad quality,poor air throw dont go by reviews present its not even throwing till 15 ft,negative
"MAHARAJA WHITELINE 65 L Desert Air Cooler??????(White, Grey, Rambo Grey / AC-303)",7999,2,moderate,very bad product very noice service man is bad responsei hate this product do not buy this waste of money,negative
"MAHARAJA WHITELINE 65 L Desert Air Cooler??????(White, Grey, Rambo Grey / AC-303)",7999,1,don't waste your money,capacity of cooler is not 65lt water indicator not work,negative
"MAHARAJA WHITELINE 65 L Desert Air Cooler??????(White, Grey, Rambo Grey / AC-303)",7999,4,very good,nice and but the room is not so cool a i dont know why,negative
"MAHARAJA WHITELINE 65 L Desert Air Cooler??????(White, Grey, Rambo Grey / AC-303)",7999,1,utterly disappointed,bad quality product,negative
"MAHARAJA WHITELINE 65 L Desert Air Cooler??????(White, Grey, Rambo Grey / AC-303)",7999,1,terrible product,worst cooling normal table fan is better compared to this no cooling,negative
"MAHARAJA WHITELINE 65 L Desert Air Cooler??????(White, Grey, Rambo Grey / AC-303)",7999,1,don't waste your money,absolutely useless product please never buy it even after technician coming and checking that the product was not working still the exchange was not accepted a big scam by flipkart total disgrace,negative
"MAHARAJA WHITELINE 65 L Desert Air Cooler??????(White, Grey, Rambo Grey / AC-303)",7999,3,good,more noise and some times lightly bad smell actually no proper cooling,negative
"MAHARAJA WHITELINE 65 L Desert Air Cooler??????(White, Grey, Rambo Grey / AC-303)",7999,4,really nice,if you can provide trolley wheels stand along with the cooler it would be awsome and 5star product it is bit difficult to find a stand for this particular model as it is a jumbo one,negative
"MAHARAJA WHITELINE 65 L Desert Air Cooler??????(White, Grey, Rambo Grey / AC-303)",7999,1,hated it!,not that good that mentioned,negative
"MAHARAJA WHITELINE 65 L Desert Air Cooler??????(White, Grey, Rambo Grey / AC-303)",7999,1,waste of money!,worst cooler ever poor cooling fan speed is too slow even my normal ceiling fan provides better air worst product from maharaja and flipkart sad part is they do not refund the money as well only replacement option is availablevery disappointed from flipkart,negative
"MAHARAJA WHITELINE 65 L Desert Air Cooler??????(White, Grey, Rambo Grey / AC-303)",7999,1,worst experience ever!,worst,negative
"MAHARAJA WHITELINE 65 L Desert Air Cooler??????(White, Grey, Rambo Grey / AC-303)",7999,3,decent product,not up to the mark in didplay front side l1 l2 blinkings are displayingbut the same is missing in productfan speed is not up to expectations and cooling also very lessfeeling humidity in room over all experience is average product i can give 3 out of 5by seeing previous reviews and experiences i had bought it but i dont recommend to others,negative
"MAHARAJA WHITELINE 65 L Desert Air Cooler??????(White, Grey, Rambo Grey / AC-303)",7999,4,good quality product,good quality product cooling superb water filling only through water pipe nice design but no power main switch no direct power on off switch extra cooler stand required,negative
"MAHARAJA WHITELINE 65 L Desert Air Cooler??????(White, Grey, Rambo Grey / AC-303)",7999,5,simply awesome,well bulid quality and excellent cooling air but the water pump is not that good,negative
"MAHARAJA WHITELINE 65 L Desert Air Cooler??????(White, Grey, Rambo Grey / AC-303)",7999,1,terrible product,with in 1 month fan blade broken suddenly noisy and vibrating cooler,negative
"MAHARAJA WHITELINE 65 L Desert Air Cooler??????(White, Grey, Rambo Grey / AC-303)",7999,1,worthless,worst experience with flipkart,negative
"MAHARAJA WHITELINE 65 L Desert Air Cooler??????(White, Grey, Rambo Grey / AC-303)",7999,1,horrible,bad bad quality and bad courier service,negative
"MAHARAJA WHITELINE 65 L Desert Air Cooler??????(White, Grey, Rambo Grey / AC-303)",7999,1,worthless,very bad product totally vest of money,negative
"MAHARAJA WHITELINE 65 L Desert Air Cooler??????(White, Grey, Rambo Grey / AC-303)",7999,1,terrible product,not working properly not able return also so for me it is verry bad product it should be returnable product cause if it is not working properly people have choice to book different one very bad product,negative
"MAHARAJA WHITELINE 65 L Desert Air Cooler??????(White, Grey, Rambo Grey / AC-303)",7999,1,hated it!,large sizecooling is low,negative
"MAHARAJA WHITELINE 65 L Desert Air Cooler??????(White, Grey, Rambo Grey / AC-303)",7999,1,utterly disappointed,body veey poor,negative
"MAHARAJA WHITELINE 65 L Desert Air Cooler??????(White, Grey, Rambo Grey / AC-303)",7999,1,not recommended at all,maharaja cooler very poor colety,negative
"MAHARAJA WHITELINE 65 L Desert Air Cooler??????(White, Grey, Rambo Grey / AC-303)",7999,2,not good,not worthy,negative
"MAHARAJA WHITELINE 65 L Desert Air Cooler??????(White, Grey, Rambo Grey / AC-303)",7999,5,simply awesome,fan speed is good but cooling is not goodand size is also very big more space taken smell coming from honeycomb padso im not happy,negative
"MAHARAJA WHITELINE 65 L Desert Air Cooler??????(White, Grey, Rambo Grey / AC-303)",7999,2,moderate,very bad product,negative
"MAHARAJA WHITELINE 65 L Desert Air Cooler??????(White, Grey, Rambo Grey / AC-303)",7999,2,moderate,cooler is average small size and costly rather than market,negative
"MAHARAJA WHITELINE 65 L Desert Air Cooler??????(White, Grey, Rambo Grey / AC-303)",7999,3,nice,nice product but flipcart delayed the delivery 10 days,negative
"MAHARAJA WHITELINE 65 L Desert Air Cooler??????(White, Grey, Rambo Grey / AC-303)",7999,1,hated it!,worst product,negative
"MAHARAJA WHITELINE 65 L Desert Air Cooler??????(White, Grey, Rambo Grey / AC-303)",7999,1,waste of money!,very big and very worst performance total money waste,negative
"Crompton 75 L Desert Air Cooler??????(White, Teal, ACGC-DAC751)",9999,1,don't waste your money,water pump is not throwing a lot of water thats why its throwing warm air not satisfied with this kind of pump quality i have paid a lot for this not worth the money there is no work of ice chamber i need a partial refund,negative
"Crompton 75 L Desert Air Cooler??????(White, Teal, ACGC-DAC751)",9999,3,nice,very bad ever packageing by flipkart i have seen when i open its outer layer its been already open looks like used product air throw quality is not good as expected its water meter is very top of its water tank if you want to see its minimum level of water then u have to fill atlest 50 liter of water no any support of up and down its air wing and its not cover very much area overall just ok not very satisfied,negative
"Crompton 75 L Desert Air Cooler??????(White, Teal, ACGC-DAC751)",9999,4,value-for-money,crompton offers this range of coolers ozone with multiple capacity of water tank though the fan motor and air flow capacity remains the same which should not have been the case i bought the 88 litre model satisfied with cooling but the castor wheels are not strong enough for the weight of 88 litre filled water tank suggestion is to go for 75 litre instead of 88 litre variant,negative
"Crompton 75 L Desert Air Cooler??????(White, Teal, ACGC-DAC751)",9999,1,unsatisfactory,its vertical swing quality is bad when you set to upward then automatically it goes to down due to this air goes to down we cant set direction as we wantvertical swing is uselesswater filling opening box is too small when u fill with jug many water goes to outside cooler ice chamber is useless ice cube water goes to 88 liter chamber how some ice can cool 88 ltr ice chamber need to direct connect to honeycomb pad and slides that it cool instantlyit make some noise too during,negative
"Crompton 75 L Desert Air Cooler??????(White, Teal, ACGC-DAC751)",9999,1,utterly disappointed,never purchase cooler from flipkartmy 10500 wastedpump not working honey comb drynot giving cool airthe up and down slider is also not working when you manually do it up it will go down itself after few minutes giving only air in downwardi am a regular flipkart customer and was trusting flipkart but after this cooler purchasing experience i hate flipkart from now and ill never do any order at flipkartive requested for return that was 7 days replacement policy buttechnician came and,negative
"Crompton 75 L Desert Air Cooler??????(White, Teal, ACGC-DAC751)",9999,1,unsatisfactory,air throw is very disappointingi thought it was a good cooler but its not they mentioned that it is for 450sq feet but it cant even cool my little 150sq feet room in 40 degree temp also i have tried all the way for ventilation but it always creates humidity and thats the bad part i suggest to dont buy this you can even buy a local brand cooler from the show which far better than this,negative
"Crompton 75 L Desert Air Cooler??????(White, Teal, ACGC-DAC751)",9999,1,did not meet expectations,it is old model and dont have outlet for draining dirty water we have to clean it manually and do lot of physical work usually the water becomes stinky once in a month we have to remove the screws and use motor to pump out the water the screws are not stainless steel so they get rusted easily and makes it difficult to remove the wheels get stuck within a month theres no manual how to remove and clean honeycomb the only positive point is its air throwing capacity and ability to cool,negative
"Crompton 75 L Desert Air Cooler??????(White, Teal, ACGC-DAC751)",9999,1,don't waste your money,i baught this cooler looking at the number of reviews and rating as i always do and as expected cooler built quality is good but the main function of cooling has a design defect the water supplied through the channel has some design defect because of which none of the honeycomb panels gets wet completely and hence cooling effect is very less people may not have noticed this if they are from relatively not that hot places like pune mumbai or bangalore etc i would not recommend this product,negative
"Crompton 75 L Desert Air Cooler??????(White, Teal, ACGC-DAC751)",9999,3,just okay,not a great product the finishing of the product is not look like it is branded one just looks like ordinary roadside product not expected this type of product from crompton i have shared my view after 2 days of usage the 3 star is for its price go for symphony this is not trust worthy,negative
"Crompton 75 L Desert Air Cooler??????(White, Teal, ACGC-DAC751)",9999,5,great product,cooling is excellent even in large hall delivery of the product is really fast i got the item in 2days first time i am experiencing this fast delivery and packing of the product not good time god there is no damage found in coolercons1 cooling the room is very fast2 air flow also good3 fan blades are made by metal because of this blades doesnt bend while cooler is running4 motor is also made by crompton5 ice adding chamber also really cool6 coaster wheels are really,negative
"Crompton 75 L Desert Air Cooler??????(White, Teal, ACGC-DAC751)",9999,1,did not meet expectations,not a good body delivery of this product is not safe it get break working is also not good,negative
"Crompton 75 L Desert Air Cooler??????(White, Teal, ACGC-DAC751)",9999,5,excellent,nice cooler cools very quick but i didnt get the manual book packaging was little damaged seller was dhamakadeal,negative
"Crompton 75 L Desert Air Cooler??????(White, Teal, ACGC-DAC751)",9999,3,decent product,cooling is ok but it smells too bad,negative
"Crompton 75 L Desert Air Cooler??????(White, Teal, ACGC-DAC751)",9999,1,not recommended at all,this cooler is wonderful i would say best desert cooler but do not buy it from flipkart at all they will pack it in worst way possible and their delivery guys will keep it in tampo with lots of load on iti received it as broken productand i know how difficult it was to get replacement in time their customer care representative gets payed only to apologize supervisormanagers even case escalate managers will have only sorry to share with youbuy this cooler but not from flipkart,negative
"Crompton 75 L Desert Air Cooler??????(White, Teal, ACGC-DAC751)",9999,1,product changed,i buy this product 55 dessert but total sent another product still now cant be returned5 times technician visit postponed and some times automatically return rejected by flipkart after i call the flipkart customer care but they agreed the problem and still product cant be retu,negative
"Crompton 75 L Desert Air Cooler??????(White, Teal, ACGC-DAC751)",9999,1,item is good but delhivery courier service worst.,item is good but delivery service of flipkart delhivery courier service is worst,negative
"Crompton 75 L Desert Air Cooler??????(White, Teal, ACGC-DAC751)",9999,1,worthless,i did not like this product its fan doesnt work properly the engineer comes and gives false hopes to my parents and returns back anf you guys have cancelled my refund this is ridiculous this is a waste productjeeves and flipkart have duped us big time,negative
"Crompton 75 L Desert Air Cooler??????(White, Teal, ACGC-DAC751)",9999,5,mind-blowing purchase,prosbuild quality looks excellentfan speed and cooling phenomenalwater lasting entire day full tanknoise acceptableair throw wide and sharpwheels tough enoughvalue for money undoubtedly extremely recommendedconspackaging could have been betterdelivery period too longmore than 5 daysbehavior of delivery boy rude illiteraterobberwas demanding for extra money to deliver on time,negative
"Crompton 75 L Desert Air Cooler??????(White, Teal, ACGC-DAC751)",9999,1,absolute rubbish!,water pump was not working,negative
"Crompton 75 L Desert Air Cooler??????(White, Teal, ACGC-DAC751)",9999,1,did not meet expectations,received defective product auto swing is not working properly better to purchase product from shopmarket where u can replace the product within a single day in my case they gave given me the 12days as a pickup time,negative
"Crompton 75 L Desert Air Cooler??????(White, Teal, ACGC-DAC751)",9999,1,useless product,product wise its finebut this time delivery service was pathetic,negative
"Crompton 75 L Desert Air Cooler??????(White, Teal, ACGC-DAC751)",9999,4,good quality product,product received good but its air flow i have confusion very less coll my 810 room i am not feeling more cool,negative
"Crompton 75 L Desert Air Cooler??????(White, Teal, ACGC-DAC751)",9999,1,worst delivery flipkart,not delivered as promised delivery person asked us to pick up with our own expenses which was around 20 kms,negative
"Crompton 75 L Desert Air Cooler??????(White, Teal, ACGC-DAC751)",9999,1,hated it!,very bad quality very poor plastic material very cheap product showing it fr 17k and then discounting it and selling fr 10k still costly as per product received just fooling people in the name of brand third class product very much disappointed from flipkart requested for return and refund on the same day refund request rejected now forced to replace the product never buy crompton and use flipkart for buying,negative
"Crompton 75 L Desert Air Cooler??????(White, Teal, ACGC-DAC751)",9999,2,slightly disappointed,cooling wise its good but when we taking about noise its too noisy the water dropping noise will irritate youalso it comes with only honey comb pad its big disadvantage is the insect will easily inter through holein this price range go for bluestar windus cooler it is coming with hybrid pad,negative
"Crompton 75 L Desert Air Cooler??????(White, Teal, ACGC-DAC751)",9999,1,very poor,it was really bad experiences with flipkart this time the delivery person was want deliver the item on road rather than mentioned address,negative
"Crompton 75 L Desert Air Cooler??????(White, Teal, ACGC-DAC751)",9999,1,waste of money!,this is worst produc air flow speed is very slow cooler outer body was very like already usedit was not expected from flipkart,negative
"Crompton 75 L Desert Air Cooler??????(White, Teal, ACGC-DAC751)",9999,2,damaged,got a damaged one,negative
"Crompton 75 L Desert Air Cooler??????(White, Teal, ACGC-DAC751)",9999,1,don't waste your money,very bad machine please dont buy it you have to take leave from your office to get it repaired within 5 months i suffering you please ignore this cooler,negative
"Crompton 75 L Desert Air Cooler??????(White, Teal, ACGC-DAC751)",9999,5,awesome,nice but wheel quality low,negative
"Crompton 75 L Desert Air Cooler??????(White, Teal, ACGC-DAC751)",9999,1,worthless,useless ice tray the ice tray water goes to the water filled in the below container obviously 100 ml of cold wouldnt gonna cool the 75 liter of water,negative
"Crompton 75 L Desert Air Cooler??????(White, Teal, ACGC-DAC751)",9999,4,really nice,coolers cooling is good but little noisy and honey comb pads if gets dirty almost impossible to clean,negative
"Crompton 75 L Desert Air Cooler??????(White, Teal, ACGC-DAC751)",9999,1,not recommended at all,not good,negative
"Crompton 75 L Desert Air Cooler??????(White, Teal, ACGC-DAC751)",9999,1,waste of money!,not working after3 months,negative
"Crompton 75 L Desert Air Cooler??????(White, Teal, ACGC-DAC751)",9999,1,did not meet expectations,quality is not good,negative
"Crompton 75 L Desert Air Cooler??????(White, Teal, ACGC-DAC751)",9999,2,could be way better,not good,negative
"Crompton 75 L Desert Air Cooler??????(White, Teal, ACGC-DAC751)",9999,1,did not meet expectations,grill is not good,negative
"Crompton 75 L Desert Air Cooler??????(White, Teal, ACGC-DAC751)",9999,5,super!,this review of two contion must read before buy any electronic products its my humble request to all i m purchase two crompton cooler from flipkart 1 75 litr date 10 april 2022 its work properly nd i m very happy of this cooler after this i m purchase again a cooler crompton 88 ltr order date 18july 2022 delivery date 28 july but delivered 30 july 2022 installation 1 aug 2022 that day i found leakage problem i m registered complain for replacement on 1 aug 2022 company say technic,negative
"Crompton 75 L Desert Air Cooler??????(White, Teal, ACGC-DAC751)",9999,2,expected a better product,more than 10 days have gone but still cooler is giving stinking air,negative
"Crompton 75 L Desert Air Cooler??????(White, Teal, ACGC-DAC751)",9999,3,just okay,the cooler works very well it has good water storage capacity and can work for the whole night when filled once but two of its wheels are depressed a little which i noticed after a few days of installation i find it really difficult move the cooler from one place to the other,negative
"Crompton 75 L Desert Air Cooler??????(White, Teal, ACGC-DAC751)",9999,2,expected a better product,after 1 month of usage pump stopped working,negative
"Crompton 75 L Desert Air Cooler??????(White, Teal, ACGC-DAC751)",9999,2,not good,not as expected,negative
"Crompton 75 L Desert Air Cooler??????(White, Teal, ACGC-DAC751)",9999,3,good,not good this product,negative
"Crompton 75 L Desert Air Cooler??????(White, Teal, ACGC-DAC751)",9999,1,did not meet expectations,very very bad productno cooling very very very very very very poor and bad product,negative
"Crompton 75 L Desert Air Cooler??????(White, Teal, ACGC-DAC751)",9999,1,hated it!,fan motor stop functioning within a week,negative
"Crompton 75 L Desert Air Cooler??????(White, Teal, ACGC-DAC751)",9999,2,not good,honey comb are very bad qualityits smelling very bad,negative
"Crompton 75 L Desert Air Cooler??????(White, Teal, ACGC-DAC751)",9999,1,horrible,worst product dont buy,negative
"Crompton 75 L Desert Air Cooler??????(White, Teal, ACGC-DAC751)",9999,2,expected a better product,ok product installation process is worst,negative
"Crompton 75 L Desert Air Cooler??????(White, Teal, ACGC-DAC751)",9999,2,expected a better product,cooling not good,negative
"Crompton 75 L Desert Air Cooler??????(White, Teal, ACGC-DAC751)",9999,1,unsatisfactory,low cooling with low rom,negative
"Crompton 75 L Desert Air Cooler??????(White, Teal, ACGC-DAC751)",9999,1,waste of money!,very bad experience this cooler not god and price high,negative
"Crompton 75 L Desert Air Cooler??????(White, Teal, ACGC-DAC751)",9999,3,just okay,while the fan and motor quality is good the problem with this cooler is its body the plastic is not very strong and the vent in front is problematic as the horizontal plastic pieces do not remain at their place leading to less air flow it is a big let down and request crompton to replace the plastic mesh in future rest of the body is also quite shaky,negative
"Crompton 75 L Desert Air Cooler??????(White, Teal, ACGC-DAC751)",9999,1,absolute rubbish!,very bed cooler its sound too much,negative
"Crompton 75 L Desert Air Cooler??????(White, Teal, ACGC-DAC751)",9999,1,hated it!,cooling not proper,negative
"Crompton 75 L Desert Air Cooler??????(White, Teal, ACGC-DAC751)",9999,1,not recommended at all,mony is wasted not ear,negative
"Crompton 75 L Desert Air Cooler??????(White, Teal, ACGC-DAC751)",9999,3,good,heavy noise front fins quality is worst road side cooler front fin quality is much better than this cooler not wort it,negative
"Crompton 75 L Desert Air Cooler??????(White, Teal, ACGC-DAC751)",9999,2,slightly disappointed,cooling is not good,negative
"Crompton 75 L Desert Air Cooler??????(White, Teal, ACGC-DAC751)",9999,1,waste of money!,leakage problem,negative
"Crompton 75 L Desert Air Cooler??????(White, Teal, ACGC-DAC751)",9999,1,terrible product,waste product,negative
"Crompton 75 L Desert Air Cooler??????(White, Teal, ACGC-DAC751)",9999,2,slightly disappointed,not provide proper cooling,negative
"Crompton 75 L Desert Air Cooler??????(White, Teal, ACGC-DAC751)",9999,3,does the job,its good cooling is fine some parts of the cooler is made of cheap plastic biggest disadvantage is the sound even at lowest speed sound is quite high,negative
"Crompton 75 L Desert Air Cooler??????(White, Teal, ACGC-DAC751)",9999,2,slightly disappointed,not good cooling,negative
"Crompton 75 L Desert Air Cooler??????(White, Teal, ACGC-DAC751)",9999,2,slightly disappointed,why its motor speed slowed down after using 1week,negative
"Crompton 75 L Desert Air Cooler??????(White, Teal, ACGC-DAC751)",9999,1,not recommended at all,too bad air throw also cooling proper ventilated room but given too much humidity,negative
"Crompton 75 L Desert Air Cooler??????(White, Teal, ACGC-DAC751)",9999,1,waste of money!,not properly work,negative
"Crompton 75 L Desert Air Cooler??????(White, Teal, ACGC-DAC751)",9999,2,moderate,air throwing distance is very low,negative
